{
  "object_type": "attorney",
  "attorney_id": "ATY_000001",
  "canonical_name": "Jordan Elise Carter",
  "name_variants": [
    "Jordan E. Carter",
    "Jordan Carter"
  ],
  "status": "active",
  "authority_zone": "internal-general",
  "confidence_posture": "reviewed",
  "primary_practice": "Insurance Coverage",
  "home_office": "Atlanta",
  "admitted_jurisdictions": [
    "Georgia"
  ],
  "bar_credentials": [
    "BARCRED_000001"
  ],
  "external_identifier_refs": [
    "EXTID_000001",
    "EXTID_000002"
  ],
  "source_profile_refs": [
    "SPROF_000001"
  ],
  "employment_episode_refs": [
    "EMP_000001"
  ],
  "notes": "Minimal canonical attorney example with one current employment episode.",
  "created_at": "2026-04-07T12:00:00Z",
  "updated_at": "2026-04-07T12:00:00Z"
}